<?xml version="1.0" encoding="UTF-8"?>
<!DOCTYPE alumnado SYSTEM "11.dtd">
<alumnado>
    <alumno>
        <datos-personales>
            <nombre>Adrian</nombre>
            <apellidos>Luque</apellidos>
            <domicilio>Rodriguez</domicilio>
            <telefonos>
                <telefono tipo="propio">618554433</telefono>
                <telefono>954112233</telefono>
            </telefonos>
            <lugar-nacimiento>Mi casa</lugar-nacimiento>
        </datos-personales>
        <equipo-deportivo>Nothingam Miedo FC</equipo-deportivo>
        <aficiones>
            <aficion>Cine</aficion>
            <aficion>Ajedrez</aficion>
        </aficiones>
        <comentarios>
            <comentario>Excelente, ha hecho sus ejercicios</comentario>
        </comentarios>
        <notas>
            <nota>7</nota>
            <nota>10</nota>
            <nota>8</nota>
        </notas>
    </alumno>
</alumnado>